<?xml version="1.0" encoding="UTF-8"?>
<updateIndex xmlns:xsi="http://www.w3.org/2001/XMLSchema-instance" xsi:noNamespaceSchemaLocation="updateIndex.xsd">
  <indexUrl>indexUrl</indexUrl>
  <updateEntries>
    <updateEntry>
      <package>package</package>
      <versionCode>0</versionCode>
      <versionName>versionName</versionName>
      <applicationName>applicationName</applicationName>
      <description>description</description>
    </updateEntry>
  </updateEntries>
</updateIndex>
